{
  "schema": "playout-summary/v1",
  "lane": "simulated",
  "scenario_id": "synth-gap",
  "scenario_sha256": "a1b2c3d4e5f6a7b8c9d0e1f2a3b4c5d6e7f8a9b0c1d2e3f4a5b6c7d8e9f0a1b2",
  "producer": {
    "kind": "simulation",
    "claim_strength": "simulation-derived"
  },
  "trials": [
    {
      "rung": 0,
      "trial": 1,
      "action_labels": ["read-tests", "add-positive-filter"],
      "outcome_signal": "task-declared-done",
      "stop_reason": "task_declared_done"
    },
    {
      "rung": 0,
      "trial": 2,
      "action_labels": ["read-tests", "improvise-shortcut"],
      "outcome_signal": "max-turns",
      "stop_reason": "max_turns"
    }
  ]
}
